[
	{
		"goal_info": "Open a new Chrome private window",
		"image/ui_annotations_positions": [
			[
				0.07222222536802292,
				0.12222222238779068,
				0.014814814552664757,
				0.0833333358168602
			],
			[
				0.07314814627170563,
				0.06296296417713165,
				0.015740741044282913,
				0.04444444552063942
			],
			[
				0.7537037134170532,
				0.47592592239379883,
				0.03703703731298447,
				0.03888889029622078
			],
			[
				0.7546296119689941,
				0.09814814478158951,
				0.03611111268401146,
				0.04259259253740311
			],
			[
				0.7555555701255798,
				0.855555534362793,
				0.034259259700775146,
				0.04259259253740311
			],
			[
				0.7574074268341064,
				0.28518518805503845,
				0.029629629105329514,
				0.04444444552063942
			],
			[
				0.8666666746139526,
				0.10740740597248077,
				0.03703703731298447,
				0.040740739554166794
			],
			[
				0.8675925731658936,
				0.855555534362793,
				0.035185184329748154,
				0.03333333507180214
			],
			[
				0.9564814567565918,
				0.192592591047287,
				0.025925925001502037,
				0.025925925001502037
			],
			[
				0.9564814567565918,
				0.7722222208976746,
				0.026851851493120193,
				0.02777777798473835
			],
			[
				0.9583333134651184,
				0.4833333194255829,
				0.02222222276031971,
				0.025925925001502037
			]
		],
		"episode_length": 9,
		"image/height": 1080,
		"image/encoded": "<image>",
		"current_activity": "com.android.chrome/com.google.android.apps.chrome.Main",
		"image/ui_annotations_ui_types": [
			"TEXT",
			"TEXT",
			"ICON_PLAY",
			"ICON_CALL",
			"ICON_SETTINGS",
			"ICON_CHAT",
			"ICON_GOOGLE",
			"ICON_MIC",
			"ICON_V_BACKWARD",
			"ICON_NAV_BAR_RECT",
			"ICON_NAV_BAR_CIRCLE"
		],
		"episode_id": "12172380859428428757",
		"android_api_level": 31,
		"step_id": 0,
		"results/type_action": "",
		"results/yx_lift": [
			0.7761470675468445,
			0.70892333984375
		],
		"device_type": "PIXEL_3",
		"image/channels": 3,
		"image/width": 540,
		"results/yx_touch": [
			0.7761470675468445,
			0.70892333984375
		],
		"results/action_type": "enter",
		"image/ui_annotations_text": [
			"Oct7",
			"Fri,",
			"",
			"",
			"",
			"",
			"",
			"",
			"",
			"",
			""
		]
	},
	{
		"device_type": "PIXEL_3",
		"image/width": 540,
		"image/encoded": "<image>",
		"episode_length": 9,
		"image/ui_annotations_ui_types": [
			"TEXT",
			"TEXT",
			"TEXT",
			"TEXT",
			"TEXT",
			"TEXT",
			"TEXT",
			"TEXT",
			"TEXT",
			"ICON_CHECK",
			"TEXT",
			"TEXT",
			"ICON_CALL",
			"ICON_PLAY",
			"ICON_SETTINGS",
			"TEXT",
			"ICON_GOOGLE",
			"ICON_MIC",
			"ICON_V_BACKWARD",
			"ICON_NAV_BAR_RECT",
			"ICON_NAV_BAR_CIRCLE"
		],
		"results/yx_lift": [
			0.7190988063812256,
			0.4153875708580017
		],
		"results/type_action": "",
		"goal_info": "Open a new Chrome private window",
		"android_api_level": 31,
		"image/ui_annotations_positions": [
			[
				0.07129629701375961,
				0.0555555559694767,
				0.01666666753590107,
				0.046296294778585434
			],
			[
				0.07222222536802292,
				0.12037037312984467,
				0.013888888992369175,
				0.08518518507480621
			],
			[
				0.4712963104248047,
				0.31296294927597046,
				0.015740741044282913,
				0.3740740716457367
			],
			[
				0.529629647731781,
				0.17777778208255768,
				0.012037036940455437,
				0.5537037253379822
			],
			[
				0.5509259104728699,
				0.17592592537403107,
				0.012037036940455437,
				0.4444444477558136
			],
			[
				0.5509259104728699,
				0.6314814686775208,
				0.010185184888541698,
				0.12777778506278992
			],
			[
				0.5722222328186035,
				0.17592592537403107,
				0.010185184888541698,
				0.3222222328186035
			],
			[
				0.6064814925193787,
				0.26851850748062134,
				0.012962962500751019,
				0.4203703701496124
			],
			[
				0.6092592477798462,
				0.699999988079071,
				0.010185184888541698,
				0.06666667014360428
			],
			[
				0.6111111044883728,
				0.192592591047287,
				0.02222222276031971,
				0.024074073880910873
			],
			[
				0.6277777552604675,
				0.26851850748062134,
				0.013888888992369175,
				0.4277777671813965
			],
			[
				0.7129629850387573,
				0.39629629254341125,
				0.012037036940455437,
				0.2074074000120163
			],
			[
				0.7537037134170532,
				0.09259258955717087,
				0.03703703731298447,
				0.05000000074505806
			],
			[
				0.7555555701255798,
				0.47962963581085205,
				0.03333333507180214,
				0.03333333507180214
			],
			[
				0.760185182094574,
				0.8574073910713196,
				0.025925925001502037,
				0.03703703731298447
			],
			[
				0.8629629611968994,
				0.0833333358168602,
				0.04444444552063942,
				0.06851851940155029
			],
			[
				0.8675925731658936,
				0.10740740597248077,
				0.034259259700775146,
				0.03888889029622078
			],
			[
				0.8675925731658936,
				0.855555534362793,
				0.034259259700775146,
				0.029629629105329514
			],
			[
				0.9564814567565918,
				0.192592591047287,
				0.025925925001502037,
				0.025925925001502037
			],
			[
				0.9564814567565918,
				0.7722222208976746,
				0.025925925001502037,
				0.02777777798473835
			],
			[
				0.9574074149131775,
				0.4833333194255829,
				0.024074073880910873,
				0.025925925001502037
			]
		],
		"image/ui_annotations_text": [
			"Fri",
			"Oct 7",
			"Welcome to Chrome",
			"By using Chrome, you agree to the Google Terms",
			"of Service, and the Google Chrome and",
			"Chrome OS",
			"Additional Terms of Service.",
			"Help make Chrome better by sending",
			"usage",
			"",
			"statistics and crash reports to Google.",
			"Accept & continue",
			"",
			"",
			"",
			"G",
			"",
			"",
			"",
			"",
			""
		],
		"results/action_type": "enter",
		"image/channels": 3,
		"results/yx_touch": [
			0.7190988063812256,
			0.4153875708580017
		],
		"episode_id": "12172380859428428757",
		"current_activity": "com.android.chrome/com.google.android.apps.chrome.Main",
		"step_id": 1,
		"image/height": 1080
	},
	{
		"goal_info": "Open a new Chrome private window",
		"episode_id": "12172380859428428757",
		"results/action_type": "enter",
		"image/ui_annotations_text": [
			"Fri",
			"Oct 7",
			"Turn on sync?",
			"",
			"Eli",
			"Brennan",
			"",
			"tau.elibrennan.1654798856749 @gmail.com",
			"Sync your passwords,",
			"history & more",
			"all",
			"devices",
			"on",
			"Google may use your history to personalize Search, ads, and other",
			"Google services",
			"You can always choose what to sync in settings.",
			"Yes,",
			"No thanks",
			"I'm",
			"in",
			"",
			"",
			"",
			"G",
			"",
			"",
			"",
			"",
			""
		],
		"image/encoded": "<image>",
		"device_type": "PIXEL_3",
		"image/channels": 3,
		"android_api_level": 31,
		"results/type_action": "",
		"step_id": 2,
		"results/yx_touch": [
			0.7183774709701538,
			0.7788368463516235
		],
		"current_activity": "com.android.chrome/com.google.android.apps.chrome.Main",
		"image/width": 540,
		"results/yx_lift": [
			0.7183774709701538,
			0.7788368463516235
		],
		"image/ui_annotations_ui_types": [
			"TEXT",
			"TEXT",
			"TEXT",
			"ICON_PERSON",
			"TEXT",
			"TEXT",
			"ICON_V_DOWNWARD",
			"TEXT",
			"TEXT",
			"TEXT",
			"TEXT",
			"TEXT",
			"TEXT",
			"TEXT",
			"TEXT",
			"TEXT",
			"TEXT",
			"TEXT",
			"TEXT",
			"TEXT",
			"ICON_CALL",
			"ICON_PLAY",
			"ICON_SETTINGS",
			"TEXT",
			"ICON_GOOGLE",
			"ICON_MIC",
			"ICON_V_BACKWARD",
			"ICON_NAV_BAR_RECT",
			"ICON_NAV_BAR_CIRCLE"
		],
		"image/ui_annotations_positions": [
			[
				0.07222222536802292,
				0.0555555559694767,
				0.01666666753590107,
				0.046296294778585434
			],
			[
				0.07314814627170563,
				0.12037037312984467,
				0.013888888992369175,
				0.08518518507480621
			],
			[
				0.36666667461395264,
				0.0833333358168602,
				0.01944444514811039,
				0.25
			],
			[
				0.4185185134410858,
				0.1388888955116272,
				0.03333333507180214,
				0.03703703731298447
			],
			[
				0.42314815521240234,
				0.2351851910352707,
				0.011111111380159855,
				0.02777777798473835
			],
			[
				0.42314815521240234,
				0.27407407760620117,
				0.012037036940455437,
				0.10370370000600815
			],
			[
				0.4277777671813965,
				0.855555534362793,
				0.015740741044282913,
				0.020370369777083397
			],
			[
				0.4416666626930237,
				0.2203703671693802,
				0.013888888992369175,
				0.5166666507720947
			],
			[
				0.49166667461395264,
				0.08518518507480621,
				0.013888888992369175,
				0.28333333134651184
			],
			[
				0.49166667461395264,
				0.37962964177131653,
				0.013888888992369175,
				0.18703703582286835
			],
			[
				0.49166667461395264,
				0.6185185313224792,
				0.011111111380159855,
				0.025925925001502037
			],
			[
				0.49166667461395264,
				0.6555555462837219,
				0.011111111380159855,
				0.10000000149011612
			],
			[
				0.49444442987442017,
				0.5777778029441833,
				0.008333333767950535,
				0.029629629105329514
			],
			[
				0.5111111402511597,
				0.08518518507480621,
				0.012962962500751019,
				0.75
			],
			[
				0.5259259343147278,
				0.08518518507480621,
				0.012962962500751019,
				0.17777778208255768
			],
			[
				0.5777778029441833,
				0.0833333358168602,
				0.012037036940455437,
				0.5425925850868225
			],
			[
				0.7194444537162781,
				0.7685185074806213,
				0.012037036940455437,
				0.04444444552063942
			],
			[
				0.720370352268219,
				0.11666666716337204,
				0.010185184888541698,
				0.11666666716337204
			],
			[
				0.720370352268219,
				0.8222222328186035,
				0.009259259328246117,
				0.03333333507180214
			],
			[
				0.720370352268219,
				0.864814817905426,
				0.010185184888541698,
				0.018518518656492233
			],
			[
				0.7509258985519409,
				0.09074074029922485,
				0.0416666679084301,
				0.05370370298624039
			],
			[
				0.7555555701255798,
				0.47777777910232544,
				0.035185184329748154,
				0.03703703731298447
			],
			[
				0.760185182094574,
				0.8574073910713196,
				0.025925925001502037,
				0.040740739554166794
			],
			[
				0.8620370626449585,
				0.0833333358168602,
				0.04537037014961243,
				0.06851851940155029
			],
			[